{
  "schemaId": "https://github.com/magicvr/goal-governance/schema/release-evidence/v1",
  "format": "goal-governance.release-evidence",
  "formatVersion": "1.0.0",
  "generatedAt": "2026-08-04T02:53:58.976544Z",
  "releaseStatus": "rehearsal",
  "source": {
    "commit": "1416aa26b7eb2811ce28ea6dd6463d2d1fc6aa4c",
    "branch": "dev",
    "annotatedTag": null,
    "tagObject": null
  },
  "protocol": {
    "version": "0.1.0",
    "contractSha256": "b191baa5219512b80c39ef99a5b4a134edb28b9a9af39d191c410ee18988033b",
    "matrixSha256": "ade80d629a5634dde6aab81819b98c33eef10471cc5648194468b1510186f10a",
    "candidateRevision": "v0.12.1"
  },
  "compatibilityReport": {
    "coverageStatus": "ready-for-release-evidence",
    "uncovered": [],
    "mirrorPassed": true
  },
  "checks": [
    {
      "name": "skills-contract-tests",
      "command": [
        "python",
        "-m",
        "unittest",
        "skills/tests/test_skills_orchestrator.py",
        "-v"
      ],
      "cwd": ".",
      "exitCode": 0,
      "passed": true,
      "outputSha256": "ed94993bf83e76e77ae3ceaceedebce57b44db9bc14a7f745a4d3aae7865973c",
      "output": "test_agents_template_does_not_force_web_app_dir (skills.tests.test_skills_orchestrator.TestSkillsOrchestratorPackage.test_agents_template_does_not_force_web_app_dir) ... ok\ntest_candidate_compatibility_matrix_keeps_runtime_coverage_explicit (skills.tests.test_skills_orchestrator.TestSkillsOrchestratorPackage.test_candidate_compatibility_matrix_keeps_runtime_coverage_explicit)\nVerified host cells and remaining candidate gaps must stay distinct. ... ok\ntest_claude_audit_skill_source (skills.tests.test_skills_orchestrator.TestSkillsOrchestratorPackage.test_claude_audit_skill_source) ... ok\ntest_claude_govern_skill_source (skills.tests.test_skills_orchestrator.TestSkillsOrchestratorPackage.test_claude_govern_skill_source) ... ok\ntest_codex_audit_skill_source (skills.tests.test_skills_orchestrator.TestSkillsOrchestratorPackage.test_codex_audit_skill_source) ... ok\ntest_codex_govern_skill_source (skills.tests.test_skills_orchestrator.TestSkillsOrchestratorPackage.test_codex_govern_skill_source) ... ok\ntest_contract_schema_manifest_and_fixtures_enforce_d002_semantics (skills.tests.test_skills_orchestrator.TestSkillsOrchestratorPackage.test_contract_schema_manifest_and_fixtures_enforce_d002_semantics)\nValidate D-002/D-003 schema identity, fields, and boundary fixtures. ... ok\ntest_copilot_audit_wrapper (skills.tests.test_skills_orchestrator.TestSkillsOrchestratorPackage.test_copilot_audit_wrapper) ... ok\ntest_copilot_govern_wrapper_is_primary (skills.tests.test_skills_orchestrator.TestSkillsOrchestratorPackage.test_copilot_govern_wrapper_is_primary) ... ok\ntest_core_contracts_are_mirrored_by_skills_package (skills.tests.test_skills_orchestrator.TestSkillsOrchestratorPackage.test_core_contracts_are_mirrored_by_skills_package)\nThe distributed contract must remain a byte-for-byte mirror of canonical docs. ... ok\ntest_core_d004_mirror_is_complete (skills.tests.test_skills_orchestrator.TestSkillsOrchestratorPackage.test_core_d004_mirror_is_complete)\nGOAL-019 D-004 + GOAL-001 D-025: core ships methodology + vision alignment. ... ok\ntest_core_templates_are_mirrored_by_skills_package (skills.tests.test_skills_orchestrator.TestSkillsOrchestratorPackage.test_core_templates_are_mirrored_by_skills_package)\nThe Skills package must distribute the canonical core templates unchanged. ... ok\ntest_d003_declares_baseline_and_tiered_adapter_scope (skills.tests.test_skills_orchestrator.TestSkillsOrchestratorPackage.test_d003_declares_baseline_and_tiered_adapter_scope)\nD-003 keeps commitment separate from version-fixed runtime evidence. ... ok\ntest_docs_readme_hash_ledger_matches_template_bytes (skills.tests.test_skills_orchestrator.TestSkillsOrchestratorPackage.test_docs_readme_hash_ledger_matches_template_bytes)\nCanonical templates/contracts must match staged package mirrors (GOAL-022). ... ok\ntest_govern_ergonomics_contract_is_shipped (skills.tests.test_skills_orchestrator.TestSkillsOrchestratorPackage.test_govern_ergonomics_contract_is_shipped) ... ok\ntest_grok_audit_skill_source (skills.tests.test_skills_orchestrator.TestSkillsOrchestratorPackage.test_grok_audit_skill_source) ... ok\ntest_grok_govern_skill_source (skills.tests.test_skills_orchestrator.TestSkillsOrchestratorPackage.test_grok_govern_skill_source) ... ok\ntest_independent_audit_prompt_exists (skills.tests.test_skills_orchestrator.TestSkillsOrchestratorPackage.test_independent_audit_prompt_exists) ... ok\ntest_independent_vision_review_core_is_separate_from_goal_audit (skills.tests.test_skills_orchestrator.TestSkillsOrchestratorPackage.test_independent_vision_review_core_is_separate_from_goal_audit)\nV-F-001: independent Vision Review has a dedicated ledger boundary. ... ok\ntest_independent_vision_review_entrypoints_exist (skills.tests.test_skills_orchestrator.TestSkillsOrchestratorPackage.test_independent_vision_review_entrypoints_exist)\nV-F-001: every installed host gets the dedicated Vision Review entry. ... ok\ntest_information_readiness_is_shipped_to_all_rule_surfaces (skills.tests.test_skills_orchestrator.TestSkillsOrchestratorPackage.test_information_readiness_is_shipped_to_all_rule_surfaces)\nP-005 must survive the reusable rule and host-install surfaces. ... ok\ntest_init_workspace_refuses_existing_path (skills.tests.test_skills_orchestrator.TestSkillsOrchestratorPackage.test_init_workspace_refuses_existing_path)\nGOAL-019 A-001 F-002: second -InitWorkspace on same path must fail. ... ok\ntest_install_all_ships_contract_mirror (skills.tests.test_skills_orchestrator.TestSkillsOrchestratorPackage.test_install_all_ships_contract_mirror) ... ok\ntest_install_default_slash_includes_independent_vision_review (skills.tests.test_skills_orchestrator.TestSkillsOrchestratorPackage.test_install_default_slash_includes_independent_vision_review)\nDefault install exposes both audit boundaries without form-fill primitives. ... ok\ntest_install_ps1_isolated_all_produces_govern_and_audit (skills.tests.test_skills_orchestrator.TestSkillsOrchestratorPackage.test_install_ps1_isolated_all_produces_govern_and_audit)\nExecute install.ps1 -All in a temp project; assert default product surface. ... ok\ntest_install_ps1_isolated_smoke_script_exists (skills.tests.test_skills_orchestrator.TestSkillsOrchestratorPackage.test_install_ps1_isolated_smoke_script_exists) ... ok\ntest_install_ps1_with_primitives_keeps_information_readiness (skills.tests.test_skills_orchestrator.TestSkillsOrchestratorPackage.test_install_ps1_with_primitives_keeps_information_readiness)\nOptional Copilot primitives must not silently fall behind P-005. ... ok\ntest_install_scripts_install_govern (skills.tests.test_skills_orchestrator.TestSkillsOrchestratorPackage.test_install_scripts_install_govern) ... ok\ntest_install_scripts_wire_claude_and_grok_skills (skills.tests.test_skills_orchestrator.TestSkillsOrchestratorPackage.test_install_scripts_wire_claude_and_grok_skills) ... ok\ntest_monorepo_agents_architecture_not_optional_supplement (skills.tests.test_skills_orchestrator.TestSkillsOrchestratorPackage.test_monorepo_agents_architecture_not_optional_supplement)\nGOAL-019 A-001 F-001 + A-018 F-015: root AGENTS must not call architecture optional. ... ok\ntest_orchestrator_encodes_lifecycle_and_classification (skills.tests.test_skills_orchestrator.TestSkillsOrchestratorPackage.test_orchestrator_encodes_lifecycle_and_classification) ... ok\ntest_p005_core_contract_guards_unknown_information_gates (skills.tests.test_skills_orchestrator.TestSkillsOrchestratorPackage.test_p005_core_contract_guards_unknown_information_gates)\nKeep P-005's actual gates from regressing to a keyword-only policy. ... ok\ntest_p005_operational_contract_guards_prompts_and_templates (skills.tests.test_skills_orchestrator.TestSkillsOrchestratorPackage.test_p005_operational_contract_guards_prompts_and_templates)\nPrompts/templates must operationalize gates, not merely name P-005. ... ok\ntest_portability_skills_pkg_and_required_architecture (skills.tests.test_skills_orchestrator.TestSkillsOrchestratorPackage.test_portability_skills_pkg_and_required_architecture)\nPackage may rename skills dir; architecture is co-required (GOAL-019). ... ok\ntest_primary_orchestrator_file_exists (skills.tests.test_skills_orchestrator.TestSkillsOrchestratorPackage.test_primary_orchestrator_file_exists) ... ok\ntest_primitives_exist_and_marked (skills.tests.test_skills_orchestrator.TestSkillsOrchestratorPackage.test_primitives_exist_and_marked) ... ok\ntest_progress_is_derived_and_sandbox_role_is_removed (skills.tests.test_skills_orchestrator.TestSkillsOrchestratorPackage.test_progress_is_derived_and_sandbox_role_is_removed) ... ok\ntest_prompts_readme_primary_vs_primitive (skills.tests.test_skills_orchestrator.TestSkillsOrchestratorPackage.test_prompts_readme_primary_vs_primitive) ... ok\ntest_skills_readme_default_install_documents_govern_audit_vision (skills.tests.test_skills_orchestrator.TestSkillsOrchestratorPackage.test_skills_readme_default_install_documents_govern_audit_vision)\nF-017 guard: README must match default four-entrypoint surface (incl. vision-audit). ... ok\ntest_skills_readme_documents_primary_and_audit_paths (skills.tests.test_skills_orchestrator.TestSkillsOrchestratorPackage.test_skills_readme_documents_primary_and_audit_paths) ... ok\ntest_vision_prompt_and_skills_exist (skills.tests.test_skills_orchestrator.TestSkillsOrchestratorPackage.test_vision_prompt_and_skills_exist) ... ok\ntest_workspace_protocol_is_shipped_to_skills_surfaces (skills.tests.test_skills_orchestrator.TestSkillsOrchestratorPackage.test_workspace_protocol_is_shipped_to_skills_surfaces)\nWorkspace isolation and fixed-reference rules must not remain core-doc-only. ... ok\n\n----------------------------------------------------------------------\nRan 42 tests in 1.827s\n\nOK\n",